source,fetched_at,version,file_name,type,page_number,review_id,title,comment,rating,author,author_id,date,verified,helpful_votes,review_link,variant.Style,variant,text,text.paragraphs,text.tables,category,description,budgeted,actual,variance,variance_pct,status,notes,amount,type.1,running_balance,receipt,goal_name,target,saved,remaining,progress,eta,month,income,expenses,savings,net_flow,savings_rate,text.column_1,text.column_2,text.full_text,price,link,page_scraped,year,awards,nominations,best_picture,year_scraped,raw,preprocessed,review_year
reviews_page_1.json,2026-03-22 09:22:25.843,1,,,,R3HIEYXVQFRUBV,"Powerful, Versatile & Worth Every Penny!","I absolutely love this Ninja Kitchen System! It’s very powerful and blends everything smoothly in seconds. I use it for smoothies, sauces, chopping vegetables, and even making dough — and it handles everything perfectly. The 8-cup food processor bowl is a great size for family meals. It’s easy to clean, sturdy, and feels high quality. The blades are super sharp, so be careful when washing. Definitely a great investment for any kitchen. Highly recommend!",5.0,Samira,AGIYMLDXELN6NGPUDUKSQIM5V4ZQ,,True,,https://www.amazon.com/gp/customer-reviews/R3HIEYXVQFRUBV,Pitcher + Bowl + (2) 16-oz. Cups,,,,,,,,,,,,,,,,,,,,,,,,,,,,,,,,,,,,,,,,,,
reviews_page_1.json,2026-03-22 09:22:25.884,1,,,,RYDWBH5RPKGBH,Powerful and versatile — love it!,"The Ninja Kitchen System has been an amazing addition to my kitchen. The 72 oz. blender is incredibly powerful and handles smoothies, frozen fruit, and even ice with no problem at all. The 8-cup food processor bowl is also fantastic, it chops and mixes evenly, making meal prep so much faster and easier. I love how versatile it is. Having the blender, food processor, and individual cups all in one system saves space and does everything I need. The only small downside is that when using the individual cups, it’s pretty loud. It’s not a deal breaker for me because it works so well, but just something to be aware of. Overall, it’s a strong, reliable machine that delivers great results.",5.0,Poenix33,AH2I2FNZLBC2YZGU76HSULW6E2FQ,,True,,https://www.amazon.com/gp/customer-reviews/RYDWBH5RPKGBH,Pitcher + Bowl + (2) 16-oz. Cups,,,,,,,,,,,,,,,,,,,,,,,,,,,,,,,,,,,,,,,,,,
reviews_page_1.json,2026-03-22 09:22:25.886,1,,,,R2ST6OORNLR2CO,Great blender,"Love this blender, it works great, very durable, simple design, easy to use, and very easy to clean",5.0,Kayla,AEZPXPPMWXC5XQKDUYHJPLHRFL4A,,True,,https://www.amazon.com/gp/customer-reviews/R2ST6OORNLR2CO,Pitcher + (2) 16 oz. Cups,,,,,,,,,,,,,,,,,,,,,,,,,,,,,,,,,,,,,,,,,,
reviews_page_1.json,2026-03-22 09:22:25.886,1,,,,R2O2F3NGFN5HGP,Love my Ninja,The best blender/ food processor out there. It does everything it advertises and is super easy to clean. We use ours almost daily. Its very convenient to have a machine with so many uses but takes up minimal space.,5.0,LWilliams,AFRJHLPBOCHNLBGVRESSMLBSPRUA,,True,,https://www.amazon.com/gp/customer-reviews/R2O2F3NGFN5HGP,Pitcher + Bowl + (2) 16-oz. Cups,,,,,,,,,,,,,,,,,,,,,,,,,,,,,,,,,,,,,,,,,,
reviews_page_1.json,2026-03-22 09:22:25.888,1,,,,R1US3JR30EI3OL,Does It All – Smoothies to Chopping,"We love this blender and food processor. It’s great for smoothies, chopping veggies, and even baking prep like carrot cake. The motor is powerful, and it does a really good job with chopping and blending without leaving chunks behind. Having the food processor and blender in one system saves counter space and actually gets used regularly in our kitchen. Very happy with this purchase.",5.0,Amazon Customer,AGJOJ5AS7NJ5BEYUXLBYD7K4NAJA,,True,,https://www.amazon.com/gp/customer-reviews/R1US3JR30EI3OL,Pitcher + Bowl + (2) 16-oz. Cups,,,,,,,,,,,,,,,,,,,,,,,,,,,,,,,,,,,,,,,,,,
reviews_page_1.json,2026-03-22 09:22:25.889,1,,,,REULXRRQQ7CRE,Blender is better than my Vitamix!,"Maturity is being able to admit that the Ninja blender works way better than the Vitamix. I bought a Vitamix a few years ago, but my roommate at the time had a Ninja also, and I remember the Ninja working really well. So I bought myself a Ninja, and I’m LOVING it! No more “bumping the bubble” (what we called it when I worked at Jamba Juice a million years ago) because the blades that run all the way up the cup seem to really prevent that phenomenon. I also love that the blade is removable so I can clean everything really well. So far I’ve only used the large blender, not the individual cups or the food processor. I will say that I already have a Ninja food processor that I love, and (sadly) the separate processor has/does more than this one. Had I realized that, I probably would have bought just the blender since I’m hesitant to replace the bigger/better processor with this one simply for the sake of saving space. Nevertheless, this entire system was less than my single Vitamix AND it works better for me, so overall I’m extremely happy with this purchase. Removed one star for the lack of attachments/limited usability of the processor.",4.0,LESLIE H.,AFFWRT7DUS5JV6NXHGQQD3FNRNZQ,,True,,https://www.amazon.com/gp/customer-reviews/REULXRRQQ7CRE,Pitcher + Bowl + (2) 16-oz. Cups,,,,,,,,,,,,,,,,,,,,,,,,,,,,,,,,,,,,,,,,,,
reviews_page_1.json,2026-03-22 09:22:25.890,1,,,,R36FNMX5YZ44Z8,Great product,Powerful motor for the price! Easy to use and clean.,5.0,Dkss,AEKM24EXRYTVGSX7ZWL4TGCEQVRQ,,True,,https://www.amazon.com/gp/customer-reviews/R36FNMX5YZ44Z8,Pitcher + Bowl + (2) 16-oz. Cups,,,,,,,,,,,,,,,,,,,,,,,,,,,,,,,,,,,,,,,,,,
reviews_page_1.json,2026-03-22 09:22:25.890,1,,,,R1TARV7OKJ78VA,100% would recommend,"Such a good blender. Smoothie cups are a go-to in our house. The dough ""blade"" for the food processor is clutch for so many things. Used it multiple times to shred meat - works like a charm. No leaks. Kinda loud, but what blender isn't tbf",5.0,John Q Reviewer,AFN5SGRGQDE6PNQLZTLOE7ZVUCEA,,True,,https://www.amazon.com/gp/customer-reviews/R1TARV7OKJ78VA,Pitcher + Bowl + (2) 18-oz. Cups,,,,,,,,,,,,,,,,,,,,,,,,,,,,,,,,,,,,,,,,,,
ecommerce_api,2026-03-22 21:13:18.101,1,,,,R34W2534W0ZOJG,Great performance and affordable!,"I’ve been using this blender for a while now, and overall it’s a great blender for the price. I wanted to share an honest review based on my experience using it for 3 years. This blender is powerful. It easily crushes ice and frozen fruit, and it makes very smooth smoothies, frozen drinks, and sauces. I like that it can handle tough ingredients without leaving big chunks behind. It also comes with a large 72oz pitcher, which is great for making multiple servings at once, plus two single cups that are convenient for quick smoothies on the go. Cleanup is simple since most parts are dishwasher safe, and the controls are straightforward and easy to use. For the price, its great compared to more expensive brands. The biggest downside is noise. This blender is loud, especially when crushing ice or blending frozen ingredients. If you’re sensitive to noise or live with others, it’s something to consider. Also replacing the pitcher is quite expensive, almost as expensive as the whole product so have that in mind if you break things often like me.",5.0,Anyella P.,AEIWQPJQEWROMDNC6VBTTGYCZH3Q,,True,,https://www.amazon.com/gp/customer-reviews/R34W2534W0ZOJG,Pitcher + (2) 16 oz. Cups,,,,,,,,,,,,,,,,,,,,,,,,,,,,,,,,,,,,,,,,,,
api source,2026-03-26 16:28:51.987,1,api_reviews.json,api,,R25ZCO4HAK2V5I,Awesomeness,"Amazing, simply amazing. I've always wanted a Ninja, is made preparing and blending so easy. It's design is made tough. The price while I little high for my blood is worth the quality. Blending is quicker and the texture of my protein shakes is much less chalky now.",5.0,Kaila Shakespeare,AGCLS2HL6O5RX3IT2NNBCFZHI6BA,,True,,https://www.amazon.com/gp/customer-reviews/R25ZCO4HAK2V5I,Pitcher + Bowl + (2) 16-oz. Cups,,,,,,,,,,,,,,,,,,,,,,,,,,,,,,,,,,,,,,,,,,
https://books.toscrape.com,2026-04-04 11:50:18.614,1,single_page.html,scraped,,,A Light in the Attic,No comment available.,5.0,,,,,,,,,,,,,,,,,,,,,,,,,,,,,,,,,,,,,,,£51.77,https://books.toscrape.com/catalogue/a-light-in-the-attic_1000/index.html,,,,,,,,,
https://books.toscrape.com,2026-04-04 11:50:18.668,1,single_page.html,scraped,,,Tipping the Velvet,No comment available.,5.0,,,,,,,,,,,,,,,,,,,,,,,,,,,,,,,,,,,,,,,£53.74,https://books.toscrape.com/catalogue/tipping-the-velvet_999/index.html,,,,,,,,,
https://books.toscrape.com,2026-04-04 11:50:18.669,1,single_page.html,scraped,,,Soumission,No comment available.,5.0,,,,,,,,,,,,,,,,,,,,,,,,,,,,,,,,,,,,,,,£50.10,https://books.toscrape.com/catalogue/soumission_998/index.html,,,,,,,,,
https://books.toscrape.com,2026-04-04 11:50:18.671,1,single_page.html,scraped,,,Sharp Objects,No comment available.,5.0,,,,,,,,,,,,,,,,,,,,,,,,,,,,,,,,,,,,,,,£47.82,https://books.toscrape.com/catalogue/sharp-objects_997/index.html,,,,,,,,,
https://books.toscrape.com,2026-04-04 11:50:18.672,1,single_page.html,scraped,,,Sapiens: A Brief History of Humankind,No comment available.,5.0,,,,,,,,,,,,,,,,,,,,,,,,,,,,,,,,,,,,,,,£54.23,https://books.toscrape.com/catalogue/sapiens-a-brief-history-of-humankind_996/index.html,,,,,,,,,
https://books.toscrape.com,2026-04-04 11:50:18.673,1,single_page.html,scraped,,,The Requiem Red,No comment available.,5.0,,,,,,,,,,,,,,,,,,,,,,,,,,,,,,,,,,,,,,,£22.65,https://books.toscrape.com/catalogue/the-requiem-red_995/index.html,,,,,,,,,
https://books.toscrape.com,2026-04-04 11:50:18.675,1,single_page.html,scraped,,,The Dirty Little Secrets of Getting Your Dream Job,No comment available.,5.0,,,,,,,,,,,,,,,,,,,,,,,,,,,,,,,,,,,,,,,£33.34,https://books.toscrape.com/catalogue/the-dirty-little-secrets-of-getting-your-dream-job_994/index.html,,,,,,,,,
https://books.toscrape.com,2026-04-04 11:50:18.676,1,single_page.html,scraped,,,"The Coming Woman: A Novel Based on the Life of the Infamous Feminist, Victoria Woodhull",No comment available.,5.0,,,,,,,,,,,,,,,,,,,,,,,,,,,,,,,,,,,,,,,£17.93,https://books.toscrape.com/catalogue/the-coming-woman-a-novel-based-on-the-life-of-the-infamous-feminist-victoria-woodhull_993/index.html,,,,,,,,,
https://books.toscrape.com,2026-04-04 11:50:18.677,1,single_page.html,scraped,,,The Boys in the Boat: Nine Americans and Their Epic Quest for Gold at the 1936 Berlin Olympics,No comment available.,5.0,,,,,,,,,,,,,,,,,,,,,,,,,,,,,,,,,,,,,,,£22.60,https://books.toscrape.com/catalogue/the-boys-in-the-boat-nine-americans-and-their-epic-quest-for-gold-at-the-1936-berlin-olympics_992/index.html,,,,,,,,,
https://books.toscrape.com,2026-04-04 11:50:18.679,1,single_page.html,scraped,,,The Black Maria,No comment available.,5.0,,,,,,,,,,,,,,,,,,,,,,,,,,,,,,,,,,,,,,,£52.15,https://books.toscrape.com/catalogue/the-black-maria_991/index.html,,,,,,,,,
https://books.toscrape.com,2026-04-04 11:50:18.680,1,single_page.html,scraped,,,"Starving Hearts (Triangular Trade Trilogy, #1)",No comment available.,5.0,,,,,,,,,,,,,,,,,,,,,,,,,,,,,,,,,,,,,,,£13.99,https://books.toscrape.com/catalogue/starving-hearts-triangular-trade-trilogy-1_990/index.html,,,,,,,,,
https://books.toscrape.com,2026-04-04 11:50:18.682,1,single_page.html,scraped,,,Shakespeare's Sonnets,No comment available.,5.0,,,,,,,,,,,,,,,,,,,,,,,,,,,,,,,,,,,,,,,£20.66,https://books.toscrape.com/catalogue/shakespeares-sonnets_989/index.html,,,,,,,,,
https://books.toscrape.com,2026-04-04 11:50:18.682,1,single_page.html,scraped,,,Set Me Free,No comment available.,5.0,,,,,,,,,,,,,,,,,,,,,,,,,,,,,,,,,,,,,,,£17.46,https://books.toscrape.com/catalogue/set-me-free_988/index.html,,,,,,,,,
https://books.toscrape.com,2026-04-04 11:50:18.684,1,single_page.html,scraped,,,Scott Pilgrim's Precious Little Life (Scott Pilgrim #1),No comment available.,5.0,,,,,,,,,,,,,,,,,,,,,,,,,,,,,,,,,,,,,,,£52.29,https://books.toscrape.com/catalogue/scott-pilgrims-precious-little-life-scott-pilgrim-1_987/index.html,,,,,,,,,
https://books.toscrape.com,2026-04-04 11:50:18.686,1,single_page.html,scraped,,,Rip it Up and Start Again,No comment available.,5.0,,,,,,,,,,,,,,,,,,,,,,,,,,,,,,,,,,,,,,,£35.02,https://books.toscrape.com/catalogue/rip-it-up-and-start-again_986/index.html,,,,,,,,,
https://books.toscrape.com,2026-04-04 11:50:18.687,1,single_page.html,scraped,,,"Our Band Could Be Your Life: Scenes from the American Indie Underground, 1981-1991",No comment available.,5.0,,,,,,,,,,,,,,,,,,,,,,,,,,,,,,,,,,,,,,,£57.25,https://books.toscrape.com/catalogue/our-band-could-be-your-life-scenes-from-the-american-indie-underground-1981-1991_985/index.html,,,,,,,,,
https://books.toscrape.com,2026-04-04 11:50:18.689,1,single_page.html,scraped,,,Olio,No comment available.,5.0,,,,,,,,,,,,,,,,,,,,,,,,,,,,,,,,,,,,,,,£23.88,https://books.toscrape.com/catalogue/olio_984/index.html,,,,,,,,,
https://books.toscrape.com,2026-04-04 11:50:18.691,1,single_page.html,scraped,,,Mesaerion: The Best Science Fiction Stories 1800-1849,No comment available.,5.0,,,,,,,,,,,,,,,,,,,,,,,,,,,,,,,,,,,,,,,£37.59,https://books.toscrape.com/catalogue/mesaerion-the-best-science-fiction-stories-1800-1849_983/index.html,,,,,,,,,
https://books.toscrape.com,2026-04-04 11:50:18.693,1,single_page.html,scraped,,,Libertarianism for Beginners,No comment available.,5.0,,,,,,,,,,,,,,,,,,,,,,,,,,,,,,,,,,,,,,,£51.33,https://books.toscrape.com/catalogue/libertarianism-for-beginners_982/index.html,,,,,,,,,
https://books.toscrape.com,2026-04-04 11:50:18.695,1,single_page.html,scraped,,,It's Only the Himalayas,No comment available.,5.0,,,,,,,,,,,,,,,,,,,,,,,,,,,,,,,,,,,,,,,£45.17,https://books.toscrape.com/catalogue/its-only-the-himalayas_981/index.html,,,,,,,,,
https://books.toscrape.com,2026-04-04 11:50:19.660,1,books_page_1.html,scraped,1,,A Light in the Attic,No comment available.,5.0,,,,,,,,,,,,,,,,,,,,,,,,,,,,,,,,,,,,,,,£51.77,https://books.toscrape.com/catalogue/a-light-in-the-attic_1000/index.html,1.0,,,,,,,,
https://books.toscrape.com,2026-04-04 11:50:19.661,1,books_page_1.html,scraped,1,,Tipping the Velvet,No comment available.,5.0,,,,,,,,,,,,,,,,,,,,,,,,,,,,,,,,,,,,,,,£53.74,https://books.toscrape.com/catalogue/tipping-the-velvet_999/index.html,1.0,,,,,,,,
https://books.toscrape.com,2026-04-04 11:50:19.662,1,books_page_1.html,scraped,1,,Soumission,No comment available.,5.0,,,,,,,,,,,,,,,,,,,,,,,,,,,,,,,,,,,,,,,£50.10,https://books.toscrape.com/catalogue/soumission_998/index.html,1.0,,,,,,,,
https://books.toscrape.com,2026-04-04 11:50:19.663,1,books_page_1.html,scraped,1,,Sharp Objects,No comment available.,5.0,,,,,,,,,,,,,,,,,,,,,,,,,,,,,,,,,,,,,,,£47.82,https://books.toscrape.com/catalogue/sharp-objects_997/index.html,1.0,,,,,,,,
https://books.toscrape.com,2026-04-04 11:50:19.663,1,books_page_1.html,scraped,1,,Sapiens: A Brief History of Humankind,No comment available.,5.0,,,,,,,,,,,,,,,,,,,,,,,,,,,,,,,,,,,,,,,£54.23,https://books.toscrape.com/catalogue/sapiens-a-brief-history-of-humankind_996/index.html,1.0,,,,,,,,
https://books.toscrape.com,2026-04-04 11:50:19.664,1,books_page_1.html,scraped,1,,The Requiem Red,No comment available.,5.0,,,,,,,,,,,,,,,,,,,,,,,,,,,,,,,,,,,,,,,£22.65,https://books.toscrape.com/catalogue/the-requiem-red_995/index.html,1.0,,,,,,,,
https://books.toscrape.com,2026-04-04 11:50:19.665,1,books_page_1.html,scraped,1,,The Dirty Little Secrets of Getting Your Dream Job,No comment available.,5.0,,,,,,,,,,,,,,,,,,,,,,,,,,,,,,,,,,,,,,,£33.34,https://books.toscrape.com/catalogue/the-dirty-little-secrets-of-getting-your-dream-job_994/index.html,1.0,,,,,,,,
https://books.toscrape.com,2026-04-04 11:50:19.666,1,books_page_1.html,scraped,1,,"The Coming Woman: A Novel Based on the Life of the Infamous Feminist, Victoria Woodhull",No comment available.,5.0,,,,,,,,,,,,,,,,,,,,,,,,,,,,,,,,,,,,,,,£17.93,https://books.toscrape.com/catalogue/the-coming-woman-a-novel-based-on-the-life-of-the-infamous-feminist-victoria-woodhull_993/index.html,1.0,,,,,,,,
https://books.toscrape.com,2026-04-04 11:50:19.667,1,books_page_1.html,scraped,1,,The Boys in the Boat: Nine Americans and Their Epic Quest for Gold at the 1936 Berlin Olympics,No comment available.,5.0,,,,,,,,,,,,,,,,,,,,,,,,,,,,,,,,,,,,,,,£22.60,https://books.toscrape.com/catalogue/the-boys-in-the-boat-nine-americans-and-their-epic-quest-for-gold-at-the-1936-berlin-olympics_992/index.html,1.0,,,,,,,,
https://books.toscrape.com,2026-04-04 11:50:19.669,1,books_page_1.html,scraped,1,,The Black Maria,No comment available.,5.0,,,,,,,,,,,,,,,,,,,,,,,,,,,,,,,,,,,,,,,£52.15,https://books.toscrape.com/catalogue/the-black-maria_991/index.html,1.0,,,,,,,,
https://books.toscrape.com,2026-04-04 11:50:19.671,1,books_page_1.html,scraped,1,,"Starving Hearts (Triangular Trade Trilogy, #1)",No comment available.,5.0,,,,,,,,,,,,,,,,,,,,,,,,,,,,,,,,,,,,,,,£13.99,https://books.toscrape.com/catalogue/starving-hearts-triangular-trade-trilogy-1_990/index.html,1.0,,,,,,,,
https://books.toscrape.com,2026-04-04 11:50:19.673,1,books_page_1.html,scraped,1,,Shakespeare's Sonnets,No comment available.,5.0,,,,,,,,,,,,,,,,,,,,,,,,,,,,,,,,,,,,,,,£20.66,https://books.toscrape.com/catalogue/shakespeares-sonnets_989/index.html,1.0,,,,,,,,
https://books.toscrape.com,2026-04-04 11:50:19.674,1,books_page_1.html,scraped,1,,Set Me Free,No comment available.,5.0,,,,,,,,,,,,,,,,,,,,,,,,,,,,,,,,,,,,,,,£17.46,https://books.toscrape.com/catalogue/set-me-free_988/index.html,1.0,,,,,,,,
https://books.toscrape.com,2026-04-04 11:50:19.675,1,books_page_1.html,scraped,1,,Scott Pilgrim's Precious Little Life (Scott Pilgrim #1),No comment available.,5.0,,,,,,,,,,,,,,,,,,,,,,,,,,,,,,,,,,,,,,,£52.29,https://books.toscrape.com/catalogue/scott-pilgrims-precious-little-life-scott-pilgrim-1_987/index.html,1.0,,,,,,,,
https://books.toscrape.com,2026-04-04 11:50:19.676,1,books_page_1.html,scraped,1,,Rip it Up and Start Again,No comment available.,5.0,,,,,,,,,,,,,,,,,,,,,,,,,,,,,,,,,,,,,,,£35.02,https://books.toscrape.com/catalogue/rip-it-up-and-start-again_986/index.html,1.0,,,,,,,,
https://books.toscrape.com,2026-04-04 11:50:19.677,1,books_page_1.html,scraped,1,,"Our Band Could Be Your Life: Scenes from the American Indie Underground, 1981-1991",No comment available.,5.0,,,,,,,,,,,,,,,,,,,,,,,,,,,,,,,,,,,,,,,£57.25,https://books.toscrape.com/catalogue/our-band-could-be-your-life-scenes-from-the-american-indie-underground-1981-1991_985/index.html,1.0,,,,,,,,
https://books.toscrape.com,2026-04-04 11:50:19.678,1,books_page_1.html,scraped,1,,Olio,No comment available.,5.0,,,,,,,,,,,,,,,,,,,,,,,,,,,,,,,,,,,,,,,£23.88,https://books.toscrape.com/catalogue/olio_984/index.html,1.0,,,,,,,,
https://books.toscrape.com,2026-04-04 11:50:19.679,1,books_page_1.html,scraped,1,,Mesaerion: The Best Science Fiction Stories 1800-1849,No comment available.,5.0,,,,,,,,,,,,,,,,,,,,,,,,,,,,,,,,,,,,,,,£37.59,https://books.toscrape.com/catalogue/mesaerion-the-best-science-fiction-stories-1800-1849_983/index.html,1.0,,,,,,,,
https://books.toscrape.com,2026-04-04 11:50:19.680,1,books_page_1.html,scraped,1,,Libertarianism for Beginners,No comment available.,5.0,,,,,,,,,,,,,,,,,,,,,,,,,,,,,,,,,,,,,,,£51.33,https://books.toscrape.com/catalogue/libertarianism-for-beginners_982/index.html,1.0,,,,,,,,
https://books.toscrape.com,2026-04-04 11:50:19.681,1,books_page_1.html,scraped,1,,It's Only the Himalayas,No comment available.,5.0,,,,,,,,,,,,,,,,,,,,,,,,,,,,,,,,,,,,,,,£45.17,https://books.toscrape.com/catalogue/its-only-the-himalayas_981/index.html,1.0,,,,,,,,
https://books.toscrape.com,2026-04-04 11:50:22.156,1,books_page_2.html,scraped,2,,In Her Wake,No comment available.,5.0,,,,,,,,,,,,,,,,,,,,,,,,,,,,,,,,,,,,,,,£12.84,https://books.toscrape.com/catalogue/in-her-wake_980/index.html,2.0,,,,,,,,
https://books.toscrape.com,2026-04-04 11:50:22.157,1,books_page_2.html,scraped,2,,How Music Works,No comment available.,5.0,,,,,,,,,,,,,,,,,,,,,,,,,,,,,,,,,,,,,,,£37.32,https://books.toscrape.com/catalogue/how-music-works_979/index.html,2.0,,,,,,,,
https://books.toscrape.com,2026-04-04 11:50:22.158,1,books_page_2.html,scraped,2,,"Foolproof Preserving: A Guide to Small Batch Jams, Jellies, Pickles, Condiments, and More: A Foolproof Guide to Making Small Batch Jams, Jellies, Pickles, Condiments, and More",No comment available.,5.0,,,,,,,,,,,,,,,,,,,,,,,,,,,,,,,,,,,,,,,£30.52,https://books.toscrape.com/catalogue/foolproof-preserving-a-guide-to-small-batch-jams-jellies-pickles-condiments-and-more-a-foolproof-guide-to-making-small-batch-jams-jellies-pickles-condiments-and-more_978/index.html,2.0,,,,,,,,
https://books.toscrape.com,2026-04-04 11:50:22.159,1,books_page_2.html,scraped,2,,Chase Me (Paris Nights #2),No comment available.,5.0,,,,,,,,,,,,,,,,,,,,,,,,,,,,,,,,,,,,,,,£25.27,https://books.toscrape.com/catalogue/chase-me-paris-nights-2_977/index.html,2.0,,,,,,,,
https://books.toscrape.com,2026-04-04 11:50:22.160,1,books_page_2.html,scraped,2,,Black Dust,No comment available.,5.0,,,,,,,,,,,,,,,,,,,,,,,,,,,,,,,,,,,,,,,£34.53,https://books.toscrape.com/catalogue/black-dust_976/index.html,2.0,,,,,,,,
https://books.toscrape.com,2026-04-04 11:50:22.161,1,books_page_2.html,scraped,2,,Birdsong: A Story in Pictures,No comment available.,5.0,,,,,,,,,,,,,,,,,,,,,,,,,,,,,,,,,,,,,,,£54.64,https://books.toscrape.com/catalogue/birdsong-a-story-in-pictures_975/index.html,2.0,,,,,,,,
https://books.toscrape.com,2026-04-04 11:50:22.163,1,books_page_2.html,scraped,2,,America's Cradle of Quarterbacks: Western Pennsylvania's Football Factory from Johnny Unitas to Joe Montana,No comment available.,5.0,,,,,,,,,,,,,,,,,,,,,,,,,,,,,,,,,,,,,,,£22.50,https://books.toscrape.com/catalogue/americas-cradle-of-quarterbacks-western-pennsylvanias-football-factory-from-johnny-unitas-to-joe-montana_974/index.html,2.0,,,,,,,,
https://books.toscrape.com,2026-04-04 11:50:22.164,1,books_page_2.html,scraped,2,,Aladdin and His Wonderful Lamp,No comment available.,5.0,,,,,,,,,,,,,,,,,,,,,,,,,,,,,,,,,,,,,,,£53.13,https://books.toscrape.com/catalogue/aladdin-and-his-wonderful-lamp_973/index.html,2.0,,,,,,,,
https://books.toscrape.com,2026-04-04 11:50:22.165,1,books_page_2.html,scraped,2,,Worlds Elsewhere: Journeys Around Shakespeare’s Globe,No comment available.,5.0,,,,,,,,,,,,,,,,,,,,,,,,,,,,,,,,,,,,,,,£40.30,https://books.toscrape.com/catalogue/worlds-elsewhere-journeys-around-shakespeares-globe_972/index.html,2.0,,,,,,,,
https://books.toscrape.com,2026-04-04 11:50:22.169,1,books_page_2.html,scraped,2,,Wall and Piece,No comment available.,5.0,,,,,,,,,,,,,,,,,,,,,,,,,,,,,,,,,,,,,,,£44.18,https://books.toscrape.com/catalogue/wall-and-piece_971/index.html,2.0,,,,,,,,
https://books.toscrape.com,2026-04-04 11:50:22.171,1,books_page_2.html,scraped,2,,The Four Agreements: A Practical Guide to Personal Freedom,No comment available.,5.0,,,,,,,,,,,,,,,,,,,,,,,,,,,,,,,,,,,,,,,£17.66,https://books.toscrape.com/catalogue/the-four-agreements-a-practical-guide-to-personal-freedom_970/index.html,2.0,,,,,,,,
https://books.toscrape.com,2026-04-04 11:50:22.172,1,books_page_2.html,scraped,2,,The Five Love Languages: How to Express Heartfelt Commitment to Your Mate,No comment available.,5.0,,,,,,,,,,,,,,,,,,,,,,,,,,,,,,,,,,,,,,,£31.05,https://books.toscrape.com/catalogue/the-five-love-languages-how-to-express-heartfelt-commitment-to-your-mate_969/index.html,2.0,,,,,,,,
https://books.toscrape.com,2026-04-04 11:50:22.173,1,books_page_2.html,scraped,2,,The Elephant Tree,No comment available.,5.0,,,,,,,,,,,,,,,,,,,,,,,,,,,,,,,,,,,,,,,£23.82,https://books.toscrape.com/catalogue/the-elephant-tree_968/index.html,2.0,,,,,,,,
https://books.toscrape.com,2026-04-04 11:50:22.174,1,books_page_2.html,scraped,2,,The Bear and the Piano,No comment available.,5.0,,,,,,,,,,,,,,,,,,,,,,,,,,,,,,,,,,,,,,,£36.89,https://books.toscrape.com/catalogue/the-bear-and-the-piano_967/index.html,2.0,,,,,,,,
https://books.toscrape.com,2026-04-04 11:50:22.175,1,books_page_2.html,scraped,2,,Sophie's World,No comment available.,5.0,,,,,,,,,,,,,,,,,,,,,,,,,,,,,,,,,,,,,,,£15.94,https://books.toscrape.com/catalogue/sophies-world_966/index.html,2.0,,,,,,,,
https://books.toscrape.com,2026-04-04 11:50:22.176,1,books_page_2.html,scraped,2,,Penny Maybe,No comment available.,5.0,,,,,,,,,,,,,,,,,,,,,,,,,,,,,,,,,,,,,,,£33.29,https://books.toscrape.com/catalogue/penny-maybe_965/index.html,2.0,,,,,,,,
https://books.toscrape.com,2026-04-04 11:50:22.177,1,books_page_2.html,scraped,2,,Maude (1883-1993):She Grew Up with the country,No comment available.,5.0,,,,,,,,,,,,,,,,,,,,,,,,,,,,,,,,,,,,,,,£18.02,https://books.toscrape.com/catalogue/maude-1883-1993she-grew-up-with-the-country_964/index.html,2.0,,,,,,,,
https://books.toscrape.com,2026-04-04 11:50:22.178,1,books_page_2.html,scraped,2,,"In a Dark, Dark Wood",No comment available.,5.0,,,,,,,,,,,,,,,,,,,,,,,,,,,,,,,,,,,,,,,£19.63,https://books.toscrape.com/catalogue/in-a-dark-dark-wood_963/index.html,2.0,,,,,,,,
https://books.toscrape.com,2026-04-04 11:50:22.179,1,books_page_2.html,scraped,2,,Behind Closed Doors,No comment available.,5.0,,,,,,,,,,,,,,,,,,,,,,,,,,,,,,,,,,,,,,,£52.22,https://books.toscrape.com/catalogue/behind-closed-doors_962/index.html,2.0,,,,,,,,
https://books.toscrape.com,2026-04-04 11:50:22.179,1,books_page_2.html,scraped,2,,You can't bury them all: Poems,No comment available.,5.0,,,,,,,,,,,,,,,,,,,,,,,,,,,,,,,,,,,,,,,£33.63,https://books.toscrape.com/catalogue/you-cant-bury-them-all-poems_961/index.html,2.0,,,,,,,,
https://books.toscrape.com,2026-04-04 11:50:24.685,1,books_page_3.html,scraped,3,,Slow States of Collapse: Poems,No comment available.,5.0,,,,,,,,,,,,,,,,,,,,,,,,,,,,,,,,,,,,,,,£57.31,https://books.toscrape.com/catalogue/slow-states-of-collapse-poems_960/index.html,3.0,,,,,,,,
https://books.toscrape.com,2026-04-04 11:50:24.687,1,books_page_3.html,scraped,3,,Reasons to Stay Alive,No comment available.,5.0,,,,,,,,,,,,,,,,,,,,,,,,,,,,,,,,,,,,,,,£26.41,https://books.toscrape.com/catalogue/reasons-to-stay-alive_959/index.html,3.0,,,,,,,,
